{
  "$schema": "http://json-schema.org/draft-07/schema#",
  "title": "EMS Glossary Term",
  "type": "object",
  "required": [
    "id",
    "names"
  ],
  "properties": {
    "id": {
      "type": "string",
      "pattern": "^[a-z0-9-]+$"
    },
    "names": {
      "type": "array",
      "items": {
        "type": "string"
      },
      "minItems": 1
    },
    "aliases": {
      "type": "array",
      "items": {
        "type": "string"
      }
    },
    "abbr": {
      "type": "array",
      "items": {
        "type": "string"
      }
    },
    "patterns": {
      "type": "array",
      "items": {
        "type": "string"
      }
    },
    "definition": {
      "type": "string"
    },
    "html": {
      "type": "string"
    },
    "images": {
      "type": "array",
      "items": {
        "type": "object",
        "required": [
          "src"
        ],
        "properties": {
          "src": {
            "type": "string",
            "format": "uri"
          },
          "alt": {
            "type": "string"
          },
          "caption": {
            "type": "string"
          }
        }
      }
    },
    "actions": {
      "type": "array",
      "items": {
        "type": "object",
        "required": [
          "label",
          "href"
        ],
        "properties": {
          "label": {
            "type": "string"
          },
          "href": {
            "type": "string",
            "format": "uri"
          },
          "variant": {
            "type": "string",
            "enum": [
              "primary",
              "secondary"
            ]
          }
        }
      }
    },
    "tags": {
      "type": "array",
      "items": {
        "type": "string"
      }
    },
    "qa": {
      "type": "array",
      "items": {
        "type": "object",
        "required": [
          "q",
          "a"
        ],
        "properties": {
          "q": {
            "type": "string"
          },
          "a": {
            "type": "string"
          }
        }
      }
    }
  },
  "additionalProperties": false
}